{
  "$schema": "../../../../../schemas/prop-meta.schema.json",
  "id": "flakturm/vent_wall_breach",
  "name": "Flakturm Ventilation Escape Shaft & Grille",
  "category": "doors",
  "kit": "flakturm",
  "version": "1.0.0",
  "description": "Cast-iron ventilation duct wall sleeve frame with unlatched steel louver grille for escape passage.",
  "triangles": 12000,
  "materials": 1,
  "textures": [
    "diffuse",
    "normal",
    "roughness_metallic"
  ],
  "dimensions": {
    "width": 0.65,
    "height": 0.65,
    "depth": 0.4
  },
  "recommendedScale": 0.6,
  "author": "Small World Studio",
  "license": "CC0-1.0"
}
